{"description":"Imported from devices.esphome.io — see linked docs for community notes.","docs_url":"https://devices.esphome.io/devices/JDONG-X6060-lamp/","esphome":{"board":"wb3s","platform":"bk72xx"},"featured_components":[{"component_id":"light.rgbww","fields":{"cold_white_color_temperature":{"value":"6500 K"},"color_interlock":{"value":true},"id":{"value":"light_rgbww"},"name":{"value":"light_rgbww"},"warm_white_color_temperature":{"value":"2700 K"}},"id":"light_rgbww"}],"hardware":{"connectivity":["wifi"]},"id":"jdong_x6060_lamp","images":["https://raw.githubusercontent.com/esphome/esphome-devices/main/src/docs/devices/JDONG-X6060-lamp/jdong_x6060.jpeg"],"manufacturer":"","name":"JDONG X6060-450 ceiling light","pins":[{"features":["i2c_scl","uart_tx"],"gpio":0,"label":"GPIO0","notes":"I2C2 SCL • UART2 TX"},{"features":["i2c_sda","uart_rx"],"gpio":1,"label":"GPIO1","notes":"I2C2 SDA • UART2 RX"},{"features":["pwm"],"gpio":6,"label":"GPIO6","notes":"PWM"},{"features":["pwm"],"gpio":7,"label":"GPIO7","notes":"PWM"},{"features":["pwm"],"gpio":8,"label":"GPIO8","notes":"PWM"},{"features":["pwm"],"gpio":9,"label":"GPIO9","notes":"PWM"},{"features":["uart_rx"],"gpio":10,"label":"GPIO10","notes":"UART1 RX"},{"features":["uart_tx"],"gpio":11,"label":"GPIO11","notes":"UART1 TX"},{"features":["spi_clk"],"gpio":14,"label":"GPIO14","notes":"SPI SCK"},{"features":["i2c_scl"],"gpio":20,"label":"GPIO20","notes":"I2C1 SCL"},{"features":["i2c_sda"],"gpio":21,"label":"GPIO21","notes":"I2C1 SDA"},{"gpio":22,"label":"GPIO22"},{"features":["adc"],"gpio":23,"label":"GPIO23","notes":"ADC"},{"features":["pwm"],"gpio":24,"label":"GPIO24","notes":"PWM"},{"features":["pwm"],"gpio":26,"label":"GPIO26","notes":"PWM"}]}
