{"description":"","esphome":{"board":"ttgo-t1","platform":"esp32","variant":"esp32"},"id":"ttgo-t1","manufacturer":"","name":"TTGO T1","pins":[{"features":["spi_miso"],"gpio":2,"label":"GPIO2","notes":"SPI MISO"},{"features":["spi_cs"],"gpio":13,"label":"GPIO13","notes":"SPI CS"},{"features":["spi_clk"],"gpio":14,"label":"GPIO14","notes":"SPI SCK"},{"features":["spi_mosi"],"gpio":15,"label":"GPIO15","notes":"SPI MOSI"},{"gpio":22,"label":"GPIO22"},{"features":["i2c_scl"],"gpio":23,"label":"GPIO23","notes":"I2C SCL"}]}
