{"description":"Imported from devices.esphome.io — see linked docs for community notes.","docs_url":"https://devices.esphome.io/devices/Lanbon-L9/","esphome":{"board":"esp32-s3-devkitc-1","framework":"esp-idf","platform":"esp32","variant":"esp32s3"},"featured_bundles":[{"component_ids":["lcd_backlight_output","display_backlight"],"id":"display_backlight_setup","name":"Display Backlight (full setup)"},{"component_ids":["my_display","my_touchscreen"],"id":"my_touchscreen_setup","name":"my_touchscreen (full setup)"}],"featured_components":[{"component_id":"binary_sensor.gpio","fields":{"id":{"value":"proximity_sensor"},"name":{"value":"Proximity Sensor"},"pin":{"locked":true,"value":11}},"id":"proximity_sensor"},{"component_id":"display.mipi_spi","fields":{"auto_clear_enabled":{"value":false},"bus_mode":{"value":"octal"},"color_depth":{"value":"16BIT"},"color_order":{"value":"BGR"},"data_rate":{"value":"4MHz"},"dc_pin":{"locked":true,"value":17},"id":{"value":"my_display"},"invert_colors":{"value":true},"model":{"value":"st7789v"},"name":{"value":"my_display"},"reset_pin":{"locked":true,"value":4},"show_test_card":{"value":true},"update_interval":{"value":"250ms"}},"id":"my_display"},{"component_id":"light.monochromatic","fields":{"id":{"value":"display_backlight"},"name":{"value":"Display Backlight"},"output":{"value":"lcd_backlight_output"},"restore_mode":{"value":"ALWAYS_ON"}},"id":"display_backlight"},{"component_id":"output.ledc","fields":{"id":{"value":"lcd_backlight_output"},"pin":{"locked":true,"value":{"inverted":false,"number":42}}},"id":"lcd_backlight_output"},{"component_id":"sensor.pulse_meter","fields":{"accuracy_decimals":{"value":1},"device_class":{"value":"power"},"id":{"value":"power_pulse_meter"},"internal_filter_mode":{"value":"PULSE"},"name":{"value":"Power"},"pin":{"locked":true,"value":5},"state_class":{"value":"measurement"},"unit_of_measurement":{"value":"W"}},"id":"power_pulse_meter"},{"component_id":"switch.gpio","fields":{"id":{"value":"relay"},"name":{"value":"Relay"},"pin":{"locked":true,"value":{"number":36}}},"id":"relay"},{"component_id":"touchscreen.ft63x6","fields":{"display":{"value":"my_display"},"id":{"value":"my_touchscreen"},"name":{"value":"my_touchscreen"}},"id":"my_touchscreen"}],"hardware":{"connectivity":["wifi","bluetooth"]},"id":"lanbon_l9","images":["https://raw.githubusercontent.com/esphome/devices.esphome.io/main/src/docs/devices/Lanbon-L9/lanbon-l9.jpeg","https://raw.githubusercontent.com/esphome/devices.esphome.io/main/src/docs/devices/Lanbon-L9/lanbon-l9-header.png","https://raw.githubusercontent.com/esphome/devices.esphome.io/main/src/docs/devices/Lanbon-L9/lanbon-l9-esphome.png"],"manufacturer":"","name":"Lanbon L9 Smart Light Switch","pins":[{"available":false,"gpio":4,"label":"GPIO4","occupied_by":"my_display"},{"available":false,"gpio":5,"label":"GPIO5","occupied_by":"Power"},{"available":false,"gpio":11,"label":"GPIO11","occupied_by":"Proximity Sensor"},{"available":false,"gpio":17,"label":"GPIO17","occupied_by":"my_display"},{"available":false,"gpio":36,"label":"GPIO36","occupied_by":"Relay"},{"available":false,"gpio":42,"label":"GPIO42","occupied_by":"lcd_backlight_output"}]}
