{"description":"Imported from devices.esphome.io — see linked docs for community notes.","docs_url":"https://devices.esphome.io/devices/Anwio-BR30-E26-RGB-CCT-13W-Light-Bulb/","esphome":{"board":"wb3l","platform":"bk72xx"},"featured_bundles":[{"component_ids":["output_white_temp","device"],"id":"device_setup","name":"Light (full setup)"}],"featured_components":[{"component_id":"light.rgbct","fields":{"cold_white_color_temperature":{"value":"6200K"},"color_interlock":{"value":true},"color_temperature":{"value":"output_white_temp"},"id":{"value":"device"},"name":{"value":"Light"},"warm_white_color_temperature":{"value":"2000K"}},"id":"device"},{"component_id":"output.libretiny_pwm","fields":{"id":{"value":"output_white_temp"},"inverted":{"locked":true,"value":true}},"id":"output_white_temp"},{"component_id":"sensor.uptime","fields":{"device_class":{"value":"duration"},"id":{"value":"sensor_uptime_1"},"name":{"value":"Uptime"}},"id":"sensor_uptime_1"}],"hardware":{"connectivity":["wifi"]},"id":"anwio_br30_e26_rgb_cct_13w_light_bulb","images":["https://raw.githubusercontent.com/esphome/devices.esphome.io/main/src/docs/devices/Anwio-BR30-E26-RGB-CCT-13W-Light-Bulb/anwio-br30-top-down.jpg"],"manufacturer":"","name":"Anwio BR30 E26 RGBWW 13 Watt Light Bulb","pins":[{"features":["i2c_scl","uart_tx"],"gpio":0,"label":"GPIO0","notes":"I2C2 SCL • UART2 TX"},{"features":["i2c_sda","uart_rx"],"gpio":1,"label":"GPIO1","notes":"I2C2 SDA • UART2 RX"},{"features":["pwm"],"gpio":6,"label":"GPIO6","notes":"PWM"},{"features":["pwm"],"gpio":7,"label":"GPIO7","notes":"PWM"},{"features":["pwm"],"gpio":8,"label":"GPIO8","notes":"PWM"},{"features":["pwm"],"gpio":9,"label":"GPIO9","notes":"PWM"},{"features":["uart_rx"],"gpio":10,"label":"GPIO10","notes":"UART1 RX"},{"features":["uart_tx"],"gpio":11,"label":"GPIO11","notes":"UART1 TX"},{"features":["spi_clk"],"gpio":14,"label":"GPIO14","notes":"SPI SCK"},{"features":["spi_mosi"],"gpio":16,"label":"GPIO16","notes":"SPI MOSI"},{"features":["i2c_scl"],"gpio":20,"label":"GPIO20","notes":"I2C1 SCL"},{"features":["i2c_sda"],"gpio":21,"label":"GPIO21","notes":"I2C1 SDA"},{"gpio":22,"label":"GPIO22"},{"features":["adc"],"gpio":23,"label":"GPIO23","notes":"ADC"},{"features":["pwm"],"gpio":24,"label":"GPIO24","notes":"PWM"},{"features":["pwm"],"gpio":26,"label":"GPIO26","notes":"PWM"}]}
