{"description":"","esphome":{"board":"t1-u","platform":"bk72xx"},"id":"t1-u","manufacturer":"","name":"T1-U Wi-Fi Module","pins":[{"features":["uart_tx"],"gpio":0,"label":"GPIO0","notes":"UART2 TX"},{"features":["adc","uart_rx"],"gpio":1,"label":"GPIO1","notes":"UART2 RX • ADC"},{"features":["pwm"],"gpio":6,"label":"GPIO6","notes":"PWM"},{"features":["pwm"],"gpio":8,"label":"GPIO8","notes":"PWM"},{"features":["pwm"],"gpio":9,"label":"GPIO9","notes":"PWM"},{"features":["adc","uart_rx"],"gpio":10,"label":"GPIO10","notes":"UART1 RX • ADC"},{"features":["uart_tx"],"gpio":11,"label":"GPIO11","notes":"UART1 TX"},{"features":["spi_clk"],"gpio":14,"label":"GPIO14","notes":"SPI0 SCK • SPI SCK"},{"features":["spi_cs"],"gpio":15,"label":"GPIO15","notes":"SPI0 CS • SPI CS"},{"features":["spi_mosi"],"gpio":16,"label":"GPIO16","notes":"SPI0 MOSI • SPI MOSI"},{"features":["spi_miso"],"gpio":17,"label":"GPIO17","notes":"SPI0 MISO • SPI MISO"},{"features":["adc"],"gpio":20,"label":"GPIO20","notes":"ADC"},{"gpio":21,"label":"GPIO21"},{"gpio":22,"label":"GPIO22"},{"gpio":23,"label":"GPIO23"},{"features":["adc","pwm"],"gpio":24,"label":"GPIO24","notes":"ADC • PWM"},{"features":["adc","pwm"],"gpio":26,"label":"GPIO26","notes":"ADC • PWM"},{"features":["adc"],"gpio":28,"label":"GPIO28","notes":"ADC"}]}
