{"description":"Compact ESP32-S2 development board in D1 Mini form factor. Features USB-C, Wi-Fi, 4 MB flash, and 2 MB PSRAM. Drop-in upgrade for D1 Mini projects.","docs_url":"https://esphome.io/components/esp32.html","esphome":{"board":"lolin_s2_mini","framework":"esp-idf","platform":"esp32","variant":"esp32s2"},"hardware":{"connectivity":["wifi"],"cpu_frequency":"240MHz","flash_size":"4MB"},"id":"esp32-s2-mini","images":["/boards/images/_generic/esp32s2.svg"],"manufacturer":"LOLIN/Wemos","name":"LOLIN S2 Mini","pins":[{"features":["pwm","strapping"],"gpio":0,"label":"GPIO0","notes":"Strapping pin (boot mode select)"},{"features":["adc","touch","pwm"],"gpio":1,"label":"GPIO1","notes":"ADC1_CH0, Touch1"},{"features":["adc","touch","pwm"],"gpio":2,"label":"GPIO2","notes":"ADC1_CH1, Touch2"},{"features":["adc","touch","pwm"],"gpio":3,"label":"GPIO3","notes":"ADC1_CH2, Touch3"},{"features":["adc","touch","pwm"],"gpio":4,"label":"GPIO4","notes":"ADC1_CH3, Touch4"},{"features":["adc","touch","pwm"],"gpio":5,"label":"GPIO5","notes":"ADC1_CH4, Touch5"},{"features":["adc","touch","pwm"],"gpio":6,"label":"GPIO6","notes":"ADC1_CH5, Touch6"},{"features":["adc","touch","pwm"],"gpio":7,"label":"GPIO7","notes":"ADC1_CH6, Touch7"},{"features":["adc","touch","pwm","i2c_sda"],"gpio":8,"label":"GPIO8","notes":"ADC1_CH7, Touch8 — default I2C SDA"},{"features":["adc","touch","pwm","i2c_scl"],"gpio":9,"label":"GPIO9","notes":"ADC1_CH8, Touch9 — default I2C SCL"},{"features":["adc","touch","pwm"],"gpio":10,"label":"GPIO10","notes":"ADC1_CH9, Touch10"},{"features":["adc","touch","pwm"],"gpio":11,"label":"GPIO11","notes":"ADC2_CH0, Touch11"},{"features":["adc","touch","pwm"],"gpio":12,"label":"GPIO12","notes":"ADC2_CH1, Touch12"},{"features":["adc","touch","pwm"],"gpio":13,"label":"GPIO13","notes":"ADC2_CH2, Touch13"},{"features":["adc","touch","pwm"],"gpio":14,"label":"GPIO14","notes":"ADC2_CH3, Touch14"},{"features":["adc","pwm"],"gpio":15,"label":"GPIO15","notes":"ADC2_CH4","occupied_by":"Built-in LED"},{"features":["adc","pwm"],"gpio":16,"label":"GPIO16","notes":"ADC2_CH5"},{"features":["adc","dac","pwm"],"gpio":17,"label":"GPIO17","notes":"ADC2_CH6, DAC1"},{"features":["adc","dac","pwm"],"gpio":18,"label":"GPIO18","notes":"ADC2_CH7, DAC2"},{"features":["adc","pwm","usb_dm"],"gpio":19,"label":"GPIO19","notes":"ADC2_CH8, USB D-"},{"features":["adc","pwm","usb_dp"],"gpio":20,"label":"GPIO20","notes":"ADC2_CH9, USB D+"},{"features":["pwm"],"gpio":21,"label":"GPIO21"},{"available":false,"gpio":26,"label":"GPIO26","notes":"SPI Flash — do not use","occupied_by":"SPI Flash"},{"available":false,"gpio":27,"label":"GPIO27","notes":"SPI Flash — do not use","occupied_by":"SPI Flash"},{"available":false,"gpio":28,"label":"GPIO28","notes":"SPI Flash — do not use","occupied_by":"SPI Flash"},{"available":false,"gpio":29,"label":"GPIO29","notes":"SPI Flash — do not use","occupied_by":"SPI Flash"},{"available":false,"gpio":30,"label":"GPIO30","notes":"SPI Flash — do not use","occupied_by":"SPI Flash"},{"available":false,"gpio":31,"label":"GPIO31","notes":"SPI Flash — do not use","occupied_by":"SPI Flash"},{"available":false,"gpio":32,"label":"GPIO32","notes":"SPI Flash — do not use","occupied_by":"SPI Flash"},{"features":["pwm"],"gpio":33,"label":"GPIO33"},{"features":["pwm","spi_cs"],"gpio":34,"label":"GPIO34","notes":"Default SPI CS"},{"features":["pwm","spi_mosi"],"gpio":35,"label":"GPIO35","notes":"Default SPI MOSI"},{"features":["pwm","spi_clk"],"gpio":36,"label":"GPIO36","notes":"Default SPI CLK"},{"features":["pwm","spi_miso"],"gpio":37,"label":"GPIO37","notes":"Default SPI MISO"},{"features":["pwm"],"gpio":38,"label":"GPIO38"},{"features":["pwm"],"gpio":39,"label":"GPIO39"},{"features":["pwm"],"gpio":40,"label":"GPIO40"},{"features":["pwm"],"gpio":41,"label":"GPIO41"},{"features":["pwm"],"gpio":42,"label":"GPIO42"},{"features":["pwm","uart_tx"],"gpio":43,"label":"GPIO43","notes":"Default UART0 TX"},{"features":["pwm","uart_rx"],"gpio":44,"label":"GPIO44","notes":"Default UART0 RX"},{"features":["pwm","strapping"],"gpio":45,"label":"GPIO45","notes":"Strapping pin (VDD_SPI voltage select)"},{"features":["pwm","strapping"],"gpio":46,"label":"GPIO46","notes":"Strapping pin (boot mode) — input only on some revisions"}],"tags":["dev-kit","compact","usb-c"]}
