{"description":"Imported from devices.esphome.io — see linked docs for community notes.","docs_url":"https://devices.esphome.io/devices/KMC-Smart-Tap/","esphome":{"board":"esp01_1m","platform":"esp8266"},"featured_components":[{"component_id":"binary_sensor.gpio","fields":{"id":{"value":"binary_sensor_gpio_1"},"name":{"value":"KMC01 button"},"pin":{"locked":true,"value":{"inverted":true,"mode":"INPUT","number":16}}},"id":"binary_sensor_gpio_1"},{"component_id":"sensor.hlw8012","fields":{"cf1_pin":{"locked":true,"value":5},"cf_pin":{"locked":true,"value":4},"id":{"value":"sensor_hlw8012_1"},"name":{"value":"Hlw8012 1"},"sel_pin":{"locked":true,"value":12},"update_interval":{"value":"30s"}},"id":"sensor_hlw8012_1"},{"component_id":"sensor.wifi_signal","fields":{"id":{"value":"sensor_wifi_signal_1"},"name":{"value":"KMC01 WiFi signal"},"update_interval":{"value":"60s"}},"id":"sensor_wifi_signal_1"},{"component_id":"switch.gpio","fields":{"id":{"value":"outlet_3"},"name":{"value":"KMC01 Outlet 3"},"pin":{"locked":true,"value":14},"restore_mode":{"value":"RESTORE_DEFAULT_ON"}},"id":"outlet_3"},{"component_id":"switch.gpio","fields":{"id":{"value":"outlet_2"},"name":{"value":"KMC01 Outlet 2"},"pin":{"locked":true,"value":13},"restore_mode":{"value":"RESTORE_DEFAULT_ON"}},"id":"outlet_2"},{"component_id":"switch.gpio","fields":{"id":{"value":"outlet_1"},"name":{"value":"KMC01 Outlet 1"},"pin":{"locked":true,"value":15},"restore_mode":{"value":"RESTORE_DEFAULT_ON"}},"id":"outlet_1"}],"hardware":{"connectivity":["wifi"]},"id":"kmc_smart_tap","images":["https://raw.githubusercontent.com/esphome/esphome-devices/main/src/docs/devices/KMC-Smart-Tap/KMC-Smart-Tap.jpg"],"manufacturer":"","name":"KMC Smart Tap Outlet With Energy Meter","pins":[{"available":false,"gpio":4,"label":"GPIO4","occupied_by":"sensor.hlw8012"},{"available":false,"gpio":5,"label":"GPIO5","occupied_by":"sensor.hlw8012"},{"available":false,"gpio":12,"label":"GPIO12","occupied_by":"sensor.hlw8012"},{"available":false,"gpio":13,"label":"GPIO13","occupied_by":"KMC01 Outlet 2"},{"available":false,"gpio":14,"label":"GPIO14","occupied_by":"KMC01 Outlet 3"},{"available":false,"gpio":15,"label":"GPIO15","occupied_by":"KMC01 Outlet 1"},{"available":false,"gpio":16,"label":"GPIO16","occupied_by":"KMC01 button"}],"tags":["relay","compact"]}
