{"description":"","esphome":{"board":"arduino_nesso_n1","platform":"esp32","variant":"esp32c6"},"id":"arduino_nesso_n1","manufacturer":"","name":"Arduino Nesso-N1","pins":[{"features":["adc","pwm"],"gpio":0,"label":"GPIO0","notes":"ADC1_CH0"},{"features":["adc","pwm"],"gpio":1,"label":"GPIO1","notes":"ADC1_CH1"},{"features":["adc","pwm"],"gpio":2,"label":"GPIO2","notes":"ADC1_CH2"},{"features":["adc","pwm"],"gpio":3,"label":"GPIO3","notes":"ADC1_CH3"},{"features":["adc","pwm","strapping"],"gpio":4,"label":"GPIO4","notes":"ADC1_CH4 — strapping pin"},{"features":["adc","pwm","strapping"],"gpio":5,"label":"GPIO5","notes":"ADC1_CH5 — strapping pin"},{"features":["adc","pwm","i2c_sda"],"gpio":6,"label":"GPIO6","notes":"ADC1_CH6 — default I2C SDA"},{"features":["pwm","i2c_scl"],"gpio":7,"label":"GPIO7","notes":"Default I2C SCL"},{"features":["pwm","strapping"],"gpio":8,"label":"GPIO8","notes":"Strapping pin"},{"features":["pwm","strapping"],"gpio":9,"label":"GPIO9","notes":"Strapping pin (boot mode select)"},{"features":["pwm"],"gpio":10,"label":"GPIO10"},{"features":["pwm"],"gpio":11,"label":"GPIO11"},{"features":["pwm","usb_dm"],"gpio":12,"label":"GPIO12","notes":"USB Serial/JTAG D-"},{"features":["pwm","usb_dp"],"gpio":13,"label":"GPIO13","notes":"USB Serial/JTAG D+"},{"features":["pwm"],"gpio":14,"label":"GPIO14"},{"features":["pwm","strapping"],"gpio":15,"label":"GPIO15","notes":"Strapping pin"},{"features":["pwm","uart_tx"],"gpio":16,"label":"GPIO16","notes":"Default UART0 TX"},{"features":["pwm","uart_rx"],"gpio":17,"label":"GPIO17","notes":"Default UART0 RX"},{"features":["pwm"],"gpio":18,"label":"GPIO18"},{"features":["pwm"],"gpio":19,"label":"GPIO19"},{"features":["pwm"],"gpio":20,"label":"GPIO20"},{"features":["pwm"],"gpio":21,"label":"GPIO21"},{"features":["pwm"],"gpio":22,"label":"GPIO22"},{"features":["pwm"],"gpio":23,"label":"GPIO23"},{"available":false,"gpio":24,"label":"GPIO24","notes":"SPI Flash — do not use","occupied_by":"SPI Flash"},{"available":false,"gpio":25,"label":"GPIO25","notes":"SPI Flash — do not use","occupied_by":"SPI Flash"},{"available":false,"gpio":26,"label":"GPIO26","notes":"SPI Flash — do not use","occupied_by":"SPI Flash"},{"features":["pwm"],"gpio":27,"label":"GPIO27"},{"features":["pwm"],"gpio":28,"label":"GPIO28"},{"features":["pwm"],"gpio":29,"label":"GPIO29"},{"features":["pwm"],"gpio":30,"label":"GPIO30"}]}
