{"description":"","esphome":{"board":"adafruit_feather_dvi","platform":"rp2040"},"id":"adafruit_feather_dvi","manufacturer":"","name":"Adafruit Feather RP2040 DVI","pins":[{"features":["pwm","uart_tx"],"gpio":0,"label":"GPIO0","notes":"Default UART0 TX"},{"features":["pwm","uart_rx"],"gpio":1,"label":"GPIO1","notes":"Default UART0 RX"},{"features":["i2c_sda","pwm"],"gpio":2,"label":"GPIO2","notes":"Default I2C0 SDA"},{"features":["i2c_scl","pwm"],"gpio":3,"label":"GPIO3","notes":"Default I2C0 SCL"},{"features":["pwm"],"gpio":4,"label":"GPIO4"},{"features":["pwm"],"gpio":5,"label":"GPIO5"},{"features":["pwm"],"gpio":6,"label":"GPIO6"},{"features":["pwm"],"gpio":7,"label":"GPIO7"},{"features":["pwm","spi_miso"],"gpio":8,"label":"GPIO8","notes":"Default SPI0 MISO (RX)"},{"features":["pwm"],"gpio":9,"label":"GPIO9"},{"features":["pwm"],"gpio":10,"label":"GPIO10"},{"features":["pwm"],"gpio":11,"label":"GPIO11"},{"features":["pwm"],"gpio":12,"label":"GPIO12"},{"features":["pwm","spi_cs"],"gpio":13,"label":"GPIO13","notes":"Default SPI0 CS","occupied_by":"Built-in LED"},{"features":["pwm","spi_clk"],"gpio":14,"label":"GPIO14","notes":"Default SPI0 CLK"},{"features":["pwm","spi_mosi"],"gpio":15,"label":"GPIO15","notes":"Default SPI0 MOSI (TX)"},{"features":["pwm"],"gpio":16,"label":"GPIO16"},{"features":["pwm"],"gpio":17,"label":"GPIO17"},{"features":["pwm"],"gpio":18,"label":"GPIO18"},{"features":["pwm"],"gpio":19,"label":"GPIO19"},{"features":["pwm"],"gpio":20,"label":"GPIO20"},{"features":["pwm"],"gpio":21,"label":"GPIO21"},{"features":["pwm"],"gpio":22,"label":"GPIO22"},{"features":["pwm"],"gpio":23,"label":"GPIO23"},{"features":["pwm"],"gpio":24,"label":"GPIO24"},{"features":["pwm"],"gpio":25,"label":"GPIO25"},{"features":["adc","pwm"],"gpio":26,"label":"GPIO26","notes":"ADC0"},{"features":["adc","pwm"],"gpio":27,"label":"GPIO27","notes":"ADC1"},{"features":["adc","pwm"],"gpio":28,"label":"GPIO28","notes":"ADC2"},{"features":["adc","pwm"],"gpio":29,"label":"GPIO29","notes":"ADC3"}]}
