{"description":"Generic ESP32-P4 development board with rev3 (v3.0x) production silicon. Pick this only if your boot log shows \"chip revision v3.x\" — pre-rev3 boards need the plain Generic ESP32-P4 Board; the two revisions need different firmware. Select this if your specific board is not listed — not all pins may be physically accessible on your board. Note that the ESP32-P4 has no built-in WiFi or Bluetooth and typically requires a co-processor for wireless connectivity.","docs_url":"https://esphome.io/components/esp32.html","esphome":{"board":"esp32-p4_r3-evboard","framework":"esp-idf","platform":"esp32","variant":"esp32p4"},"hardware":{"connectivity":["openthread"],"cpu_frequency":"400MHz","flash_size":"16MB"},"id":"generic-esp32p4-r3","images":["/boards/images/_generic/esp32p4.svg"],"is_generic":true,"manufacturer":"Generic","name":"Generic ESP32-P4 Board (rev3)","pins":[{"features":["pwm"],"gpio":0,"label":"GPIO0"},{"features":["pwm"],"gpio":1,"label":"GPIO1"},{"features":["pwm","touch"],"gpio":2,"label":"GPIO2","notes":"Touch channel"},{"features":["pwm","touch"],"gpio":3,"label":"GPIO3","notes":"Touch channel"},{"features":["pwm","touch"],"gpio":4,"label":"GPIO4","notes":"Touch channel"},{"features":["pwm","touch"],"gpio":5,"label":"GPIO5","notes":"Touch channel"},{"features":["pwm","touch"],"gpio":6,"label":"GPIO6","notes":"Touch channel"},{"features":["pwm","touch"],"gpio":7,"label":"GPIO7","notes":"Touch channel"},{"features":["pwm","touch"],"gpio":8,"label":"GPIO8","notes":"Touch channel"},{"features":["pwm","touch"],"gpio":9,"label":"GPIO9","notes":"Touch channel"},{"features":["pwm","touch"],"gpio":10,"label":"GPIO10","notes":"Touch channel"},{"features":["pwm","touch"],"gpio":11,"label":"GPIO11","notes":"Touch channel"},{"features":["pwm","touch"],"gpio":12,"label":"GPIO12","notes":"Touch channel"},{"features":["pwm","touch"],"gpio":13,"label":"GPIO13","notes":"Touch channel"},{"features":["pwm","touch"],"gpio":14,"label":"GPIO14","notes":"Touch channel"},{"features":["pwm","touch"],"gpio":15,"label":"GPIO15","notes":"Touch channel"},{"features":["adc","pwm"],"gpio":16,"label":"GPIO16","notes":"ADC1_CH0"},{"features":["adc","pwm"],"gpio":17,"label":"GPIO17","notes":"ADC1_CH1"},{"features":["adc","pwm"],"gpio":18,"label":"GPIO18","notes":"ADC1_CH2"},{"features":["adc","pwm"],"gpio":19,"label":"GPIO19","notes":"ADC1_CH3"},{"features":["adc","pwm"],"gpio":20,"label":"GPIO20","notes":"ADC1_CH4"},{"features":["adc","pwm"],"gpio":21,"label":"GPIO21","notes":"ADC1_CH5"},{"features":["adc","pwm"],"gpio":22,"label":"GPIO22","notes":"ADC1_CH6"},{"features":["adc","pwm"],"gpio":23,"label":"GPIO23","notes":"ADC1_CH7"},{"features":["adc","pwm","usb_dm"],"gpio":24,"label":"GPIO24","notes":"ADC1_CH8 — USB OTG D-"},{"features":["adc","pwm","usb_dp"],"gpio":25,"label":"GPIO25","notes":"ADC1_CH9 — USB OTG D+"},{"features":["adc","pwm"],"gpio":26,"label":"GPIO26","notes":"ADC1_CH10"},{"features":["adc","pwm"],"gpio":27,"label":"GPIO27","notes":"ADC1_CH11"},{"features":["pwm"],"gpio":28,"label":"GPIO28"},{"features":["pwm"],"gpio":29,"label":"GPIO29"},{"features":["pwm"],"gpio":30,"label":"GPIO30"},{"features":["pwm"],"gpio":31,"label":"GPIO31"},{"features":["pwm"],"gpio":32,"label":"GPIO32"},{"features":["pwm"],"gpio":33,"label":"GPIO33"},{"features":["pwm","strapping"],"gpio":34,"label":"GPIO34","notes":"Strapping pin"},{"features":["pwm","strapping"],"gpio":35,"label":"GPIO35","notes":"Strapping pin"},{"features":["pwm","strapping"],"gpio":36,"label":"GPIO36","notes":"Strapping pin"},{"available":false,"gpio":37,"label":"GPIO37","notes":"SPI Flash — do not use","occupied_by":"SPI Flash"},{"available":false,"gpio":38,"label":"GPIO38","notes":"SPI Flash — do not use","occupied_by":"SPI Flash"},{"available":false,"gpio":39,"label":"GPIO39","notes":"SPI Flash — do not use","occupied_by":"SPI Flash"},{"available":false,"gpio":40,"label":"GPIO40","notes":"SPI Flash — do not use","occupied_by":"SPI Flash"},{"available":false,"gpio":41,"label":"GPIO41","notes":"SPI Flash — do not use","occupied_by":"SPI Flash"},{"available":false,"gpio":42,"label":"GPIO42","notes":"SPI Flash — do not use","occupied_by":"SPI Flash"},{"features":["pwm"],"gpio":43,"label":"GPIO43"},{"features":["pwm"],"gpio":44,"label":"GPIO44"},{"features":["pwm"],"gpio":45,"label":"GPIO45"},{"features":["pwm"],"gpio":46,"label":"GPIO46"},{"features":["pwm"],"gpio":47,"label":"GPIO47"},{"features":["pwm"],"gpio":48,"label":"GPIO48"},{"features":["pwm"],"gpio":49,"label":"GPIO49"},{"features":["pwm"],"gpio":50,"label":"GPIO50"},{"features":["pwm"],"gpio":51,"label":"GPIO51"},{"features":["pwm"],"gpio":52,"label":"GPIO52"},{"features":["pwm"],"gpio":53,"label":"GPIO53"},{"available":false,"gpio":54,"label":"GPIO54","occupied_by":"VDD_HP_1 power rail (pin repurposed in rev3 silicon)"}]}
