{"description":"Generic - LN882HKI (LN882X board).","docs_url":"https://esphome.io/components/libretiny.html","esphome":{"board":"generic-ln882hki","framework":"arduino","platform":"ln882x"},"hardware":{"connectivity":["wifi"]},"id":"generic-ln882hki","images":["/boards/images/_generic/ln882x.svg"],"manufacturer":"","name":"Generic - LN882HKI","pins":[{"features":["adc"],"gpio":0,"label":"GPIO0","notes":"ADC"},{"features":["adc"],"gpio":1,"label":"GPIO1","notes":"ADC"},{"features":["uart_tx"],"gpio":2,"label":"GPIO2","notes":"UART0 TX"},{"features":["uart_rx"],"gpio":3,"label":"GPIO3","notes":"UART0 RX"},{"features":["adc"],"gpio":4,"label":"GPIO4","notes":"ADC"},{"gpio":5,"label":"GPIO5"},{"gpio":6,"label":"GPIO6"},{"gpio":7,"label":"GPIO7"},{"gpio":8,"label":"GPIO8"},{"gpio":9,"label":"GPIO9"},{"gpio":10,"label":"GPIO10"},{"gpio":11,"label":"GPIO11"},{"gpio":12,"label":"GPIO12"},{"features":["adc"],"gpio":19,"label":"GPIO19","notes":"ADC"},{"features":["adc"],"gpio":20,"label":"GPIO20","notes":"ADC"},{"features":["adc"],"gpio":21,"label":"GPIO21","notes":"ADC"},{"gpio":22,"label":"GPIO22"},{"gpio":23,"label":"GPIO23"},{"features":["uart_rx"],"gpio":24,"label":"GPIO24","notes":"UART1 RX"},{"features":["uart_tx"],"gpio":25,"label":"GPIO25","notes":"UART1 TX"}]}
