{"description":"","docs_url":"https://esphome.io/components/esp32.html","esphome":{"board":"valtrack_v4_vts_esp32_c3","platform":"esp32","variant":"esp32c3"},"id":"valtrack_v4_vts_esp32_c3","manufacturer":"","name":"Valetron Systems VALTRACK-V4VTS","pins":[{"features":["adc","pwm"],"gpio":0,"label":"GPIO0","notes":"ADC1_CH0"},{"features":["adc","pwm"],"gpio":1,"label":"GPIO1","notes":"ADC1_CH1"},{"features":["adc","pwm","strapping"],"gpio":2,"label":"GPIO2","notes":"ADC1_CH2 — strapping pin"},{"features":["adc","pwm"],"gpio":3,"label":"GPIO3","notes":"ADC1_CH3"},{"features":["adc","pwm"],"gpio":4,"label":"GPIO4","notes":"ADC1_CH4"},{"features":["adc","pwm"],"gpio":5,"label":"GPIO5","notes":"ADC2_CH0"},{"features":["pwm"],"gpio":6,"label":"GPIO6","notes":"Default FSPI CLK"},{"features":["pwm"],"gpio":7,"label":"GPIO7","notes":"Default FSPI MOSI"},{"features":["pwm","i2c_sda","strapping"],"gpio":8,"label":"GPIO8","notes":"Default I2C SDA — strapping pin; commonly used for onboard RGB LED"},{"features":["pwm","i2c_scl","strapping"],"gpio":9,"label":"GPIO9","notes":"Default I2C SCL — strapping pin (boot mode select)"},{"features":["pwm"],"gpio":10,"label":"GPIO10"},{"features":["pwm"],"gpio":11,"label":"GPIO11"},{"available":false,"gpio":12,"label":"GPIO12","notes":"SPI Flash — do not use","occupied_by":"SPI Flash"},{"available":false,"gpio":13,"label":"GPIO13","notes":"SPI Flash — do not use","occupied_by":"SPI Flash"},{"available":false,"gpio":14,"label":"GPIO14","notes":"SPI Flash — do not use","occupied_by":"SPI Flash"},{"available":false,"gpio":15,"label":"GPIO15","notes":"SPI Flash — do not use","occupied_by":"SPI Flash"},{"available":false,"gpio":16,"label":"GPIO16","notes":"SPI Flash — do not use","occupied_by":"SPI Flash"},{"available":false,"gpio":17,"label":"GPIO17","notes":"SPI Flash — do not use","occupied_by":"SPI Flash"},{"features":["pwm","usb_dm"],"gpio":18,"label":"GPIO18","notes":"USB Serial/JTAG D-"},{"features":["pwm","usb_dp"],"gpio":19,"label":"GPIO19","notes":"USB Serial/JTAG D+"},{"features":["pwm","uart_rx"],"gpio":20,"label":"GPIO20","notes":"Default UART0 RX"},{"features":["pwm","uart_tx"],"gpio":21,"label":"GPIO21","notes":"Default UART0 TX"}]}
