{"description":"","esphome":{"board":"cb3l","platform":"bk72xx"},"id":"cb3l","manufacturer":"","name":"CB3L Wi-Fi Module","pins":[{"features":["i2c_scl","uart_tx"],"gpio":0,"label":"GPIO0","notes":"UART2 TX • I2C2 SCL"},{"features":["pwm"],"gpio":6,"label":"GPIO6","notes":"PWM"},{"features":["pwm"],"gpio":7,"label":"GPIO7","notes":"PWM"},{"features":["pwm"],"gpio":8,"label":"GPIO8","notes":"PWM"},{"features":["pwm"],"gpio":9,"label":"GPIO9","notes":"PWM"},{"features":["uart_rx"],"gpio":10,"label":"GPIO10","notes":"UART1 RX"},{"features":["uart_tx"],"gpio":11,"label":"GPIO11","notes":"UART1 TX"},{"features":["spi_clk"],"gpio":14,"label":"GPIO14","notes":"SPI SCK"},{"features":["i2c_sda"],"gpio":21,"label":"GPIO21","notes":"I2C1 SDA"},{"features":["adc"],"gpio":23,"label":"GPIO23","notes":"ADC"},{"features":["pwm"],"gpio":24,"label":"GPIO24","notes":"PWM"},{"features":["pwm"],"gpio":26,"label":"GPIO26","notes":"PWM"}]}
