{"description":"","esphome":{"board":"intorobot","platform":"esp32","variant":"esp32"},"id":"intorobot","manufacturer":"","name":"IntoRobot Fig","pins":[{"gpio":0,"label":"GPIO0"},{"features":["adc"],"gpio":2,"label":"GPIO2","notes":"ADC"},{"gpio":4,"label":"GPIO4"},{"gpio":5,"label":"GPIO5"},{"features":["adc"],"gpio":12,"label":"GPIO12","notes":"ADC"},{"features":["adc"],"gpio":13,"label":"GPIO13","notes":"ADC"},{"features":["adc"],"gpio":14,"label":"GPIO14","notes":"ADC"},{"features":["adc"],"gpio":15,"label":"GPIO15","notes":"ADC"},{"features":["spi_mosi"],"gpio":16,"label":"GPIO16","notes":"SPI MOSI"},{"features":["spi_miso"],"gpio":17,"label":"GPIO17","notes":"SPI MISO"},{"gpio":18,"label":"GPIO18"},{"features":["i2c_scl"],"gpio":19,"label":"GPIO19","notes":"I2C SCL"},{"gpio":21,"label":"GPIO21"},{"gpio":22,"label":"GPIO22"},{"features":["i2c_sda"],"gpio":23,"label":"GPIO23","notes":"I2C SDA"},{"features":["adc"],"gpio":25,"label":"GPIO25","notes":"ADC"},{"features":["adc"],"gpio":26,"label":"GPIO26","notes":"ADC"},{"gpio":27,"label":"GPIO27"},{"features":["adc"],"gpio":35,"label":"GPIO35","notes":"ADC"},{"features":["adc"],"gpio":39,"label":"GPIO39","notes":"ADC"}]}
