{"description":"","esphome":{"board":"heltec_wireless_stick","platform":"esp32","variant":"esp32"},"id":"heltec_wireless_stick","manufacturer":"","name":"Heltec Wireless Stick","pins":[{"gpio":0,"label":"GPIO0"},{"gpio":4,"label":"GPIO4"},{"features":["spi_clk"],"gpio":5,"label":"GPIO5","notes":"SPI SCK"},{"gpio":14,"label":"GPIO14"},{"gpio":15,"label":"GPIO15"},{"gpio":16,"label":"GPIO16"},{"features":["spi_cs"],"gpio":18,"label":"GPIO18","notes":"SPI CS"},{"gpio":21,"label":"GPIO21"},{"gpio":25,"label":"GPIO25"},{"gpio":26,"label":"GPIO26"},{"features":["spi_mosi"],"gpio":27,"label":"GPIO27","notes":"SPI MOSI"},{"gpio":34,"label":"GPIO34"},{"gpio":35,"label":"GPIO35"}]}
