{"description":"","docs_url":"https://esphome.io/components/esp32.html","esphome":{"board":"unphone7","platform":"esp32","variant":"esp32"},"id":"unphone7","manufacturer":"","name":"unPhone 7","pins":[{"features":["adc","touch","pwm","strapping"],"gpio":0,"label":"GPIO0","notes":"ADC2_CH1, Touch1 — strapping pin (boot mode select)"},{"features":["uart_tx","pwm"],"gpio":1,"label":"GPIO1","notes":"Default UART0 TX"},{"features":["adc","touch","pwm","strapping"],"gpio":2,"label":"GPIO2","notes":"ADC2_CH2, Touch2 — strapping pin (must be low/floating for flash boot)"},{"features":["uart_rx","pwm"],"gpio":3,"label":"GPIO3","notes":"Default UART0 RX"},{"features":["adc","touch","pwm"],"gpio":4,"label":"GPIO4","notes":"ADC2_CH0, Touch0"},{"features":["pwm","spi_cs","strapping"],"gpio":5,"label":"GPIO5","notes":"Default VSPI CS — strapping pin (outputs PWM at boot)"},{"available":false,"gpio":6,"label":"GPIO6","notes":"SPI Flash CLK — do not use","occupied_by":"SPI Flash"},{"available":false,"gpio":7,"label":"GPIO7","notes":"SPI Flash SD0 — do not use","occupied_by":"SPI Flash"},{"available":false,"gpio":8,"label":"GPIO8","notes":"SPI Flash SD1 — do not use","occupied_by":"SPI Flash"},{"available":false,"gpio":9,"label":"GPIO9","notes":"SPI Flash SD2 — do not use","occupied_by":"SPI Flash"},{"available":false,"gpio":10,"label":"GPIO10","notes":"SPI Flash SD3 — do not use","occupied_by":"SPI Flash"},{"available":false,"gpio":11,"label":"GPIO11","notes":"SPI Flash CMD — do not use","occupied_by":"SPI Flash"},{"features":["adc","touch","pwm","strapping"],"gpio":12,"label":"GPIO12","notes":"ADC2_CH5, Touch5 — strapping pin (must be LOW during boot for correct flash voltage)"},{"features":["adc","touch","pwm"],"gpio":13,"label":"GPIO13","notes":"ADC2_CH4, Touch4"},{"features":["adc","touch","pwm"],"gpio":14,"label":"GPIO14","notes":"ADC2_CH6, Touch6"},{"features":["adc","touch","pwm","strapping"],"gpio":15,"label":"GPIO15","notes":"ADC2_CH3, Touch3 — strapping pin (outputs PWM at boot)"},{"features":["pwm"],"gpio":16,"label":"GPIO16","notes":"UART2 RX (default)"},{"features":["pwm"],"gpio":17,"label":"GPIO17","notes":"UART2 TX (default)"},{"features":["pwm","spi_clk"],"gpio":18,"label":"GPIO18","notes":"Default VSPI CLK"},{"features":["pwm","spi_miso"],"gpio":19,"label":"GPIO19","notes":"Default VSPI MISO"},{"features":["pwm","i2c_sda"],"gpio":21,"label":"GPIO21","notes":"Default I2C SDA"},{"features":["pwm","i2c_scl"],"gpio":22,"label":"GPIO22","notes":"Default I2C SCL"},{"features":["pwm","spi_mosi"],"gpio":23,"label":"GPIO23","notes":"Default VSPI MOSI"},{"features":["adc","dac","pwm"],"gpio":25,"label":"GPIO25","notes":"ADC2_CH8, DAC1"},{"features":["adc","dac","pwm"],"gpio":26,"label":"GPIO26","notes":"ADC2_CH9, DAC2"},{"features":["adc","touch","pwm"],"gpio":27,"label":"GPIO27","notes":"ADC2_CH7, Touch7"},{"features":["adc","touch","pwm"],"gpio":32,"label":"GPIO32","notes":"ADC1_CH4, Touch9"},{"features":["adc","touch","pwm"],"gpio":33,"label":"GPIO33","notes":"ADC1_CH5, Touch8"},{"features":["adc","input_only"],"gpio":34,"label":"GPIO34","notes":"ADC1_CH6 — input only, no internal pull-up/pull-down"},{"features":["adc","input_only"],"gpio":35,"label":"GPIO35","notes":"ADC1_CH7 — input only, no internal pull-up/pull-down"},{"features":["adc","input_only"],"gpio":36,"label":"GPIO36","notes":"ADC1_CH0 (VP) — input only, no internal pull-up/pull-down"},{"features":["adc","input_only"],"gpio":37,"label":"GPIO37","notes":"ADC1_CH1 — input only, no internal pull-up/pull-down (not exposed on most boards)"},{"features":["adc","input_only"],"gpio":38,"label":"GPIO38","notes":"ADC1_CH2 — input only, no internal pull-up/pull-down (not exposed on most boards)"},{"features":["adc","input_only"],"gpio":39,"label":"GPIO39","notes":"ADC1_CH3 (VN) — input only, no internal pull-up/pull-down"}]}
